{
  "schema": 1,
  "entity_id": "binary_sensor.kitchen_motion",
  "domain": "binary_sensor",
  "object_id": "kitchen_motion",
  "state": "on",
  "available": true,
  "device_class": "motion",
  "unit": null,
  "attributes": {
    "friendly_name": "Kitchen motion"
  },
  "last_changed": "2025-10-13T12:00:00.123456+00:00",
  "ts": 1760356800123
}
